8612,Topics in Quantum Computation,The selection of topics varies from year to year. Students will make presentations based on journal articles or original research.,Not offered on a regular basis
8615,Quantum Information Science Seminar,Discussion of contemporary topics in quantum computing and quantum information.,Not offered on a regular basis
8650,Logic and Logic Programming,"Theoretical foundations of automated reasoning and logic programming. Topics covered include propositional logic, predicate logic, first-order models, resolution principles, logic programming paradigms, nonmonotonic reasoning.",Not offered on a regular basis
8720,Advanced Computer Architecture,"Advanced and high-performance computer architecture. Topics covered include hierarchical memory design, cache memory design, pipelining, vector processing and parallel processing. Case studies of vector processors and multi-processor architectures: shared memory, distributed memory, data parallel (SIMD) and control parallel (MIMD) architectures, and heterogeneous parallel computing on a network of workstations.",Not offered on a regular basis
8730,Advanced Operating Systems,Software systems geared at supporting parallel and distributed computing. Programming language support will focus on simple and efficient ways to express parallel programs. Compiler and operating system support will focus on new optimizations to make parallel programs execute more efficiently.,Not offered on a regular basis
8740,Advanced Topics in Real-Time Scheduling,"Advanced topics in real-time systems with an emphasis on scheduling issues. Topics will be different each semester. Possible topics include: multiprocessor scheduling, power-aware scheduling, application-specific scheduling (e.g., multimedia scheduling issues).",Not offered on a regular basis
8780,Advanced Topics in Distributed Systems,"The design and implementation of a wide class of distributed systems. The selection of topics will vary from year to year. Topics may include, but are not limited to, distributed file systems, peer-to-peer systems, distributed spam processing, content delivery networks, and security and privacy. \n Distributed systems have become widely pervasive and are having a tremendous impact on various domains of human activity. Today's distributed systems range from ad-hoc networks comprising of tiny sensor devices, to overlay networks such as peer-to-peer systems, to massive web farms of powerful servers. The research in the area of distributed systems has focused on achieving better performance, reliability, security, and privacy of various kinds of distributed data processing applications. In this course we will study the design, implementation and evaluation of a wide class of distributed systems including edge cache networks, multimedia content distribution networks, peer-to-peer systems, publish-subscribe systems, stream processing systems, mobile systems and sensor networks, with the objective of gaining an in-depth understanding of the requirements and the design options.",Not offered on a regular basis
8790,Advanced Topics in Data Intensive Computing,"Modern computing applications require storage, management, and processing of petabytes of data. The data is not only extremely diverse, ranging from unstructured text and relational tables to complex graphs, but it is also dynamic. This course focuses on developing scalable architectures, algorithms, and techniques for supporting various data intensive applications.",Not offered on a regular basis
8795,Advanced Topics in Cloud Computing,"This advanced course in cloud computing investigates the research that leads to the creation of “clouds” and includes in-depth discussion for new research that will soon be reflected in real- world clouds. Topics include cloud infrastructure, microservices, cloud functions, cloud-based large-scale machine learning and AI, and cloud IoT.",Not offered on a regular basis
8810,Image Processing and Computer Graphics,"Image processing and computer graphics. Topics include: image representation, restoration, transformation, classification, compression, enhancement, segmentation, image filter, design, histogram techniques, sampling and quantization, Fast Fourier Transform, image data structures, parallel/distributed processing, illumination models and surface-rendering methods. A number of applications will be presented as case studies.",Not offered on a regular basis
8820,Computer Vision and Pattern Recognition,"Low-level and high-level vision including edge detection, connected component labeling, boundary detection, segmentation, stereopsis, motion analysis, and object recognition. Knowledge representation, knowledge retrieval and reasoning techniques in computer vision. Parallel computing, parallel architectures and neural computing for computer vision.",Not offered on a regular basis
8840,Advanced Image Analysis,"Gain in-depth understanding, knowledge, and the ability to apply cutting-edge methods to process and quantitatively analyze images. This class presents modern image analysis tools, including wavelets, adaptive filters, active contours, and fractals. An important aspect is the design of unsupervised image analysis chains.",Not offered on a regular basis
8850,Advanced Biomedical Image Analysis,"Introduction to advanced approaches to, and applications of, biomedical image analysis, including imaging biomarker discovery, computer-aided diagnosis, computer-aided follow-up, image-guided therapy, molecular imaging, functional imaging, and translational imaging. Advanced applications of state-of- the-art biomedical image analysis software systems will be emphasized.",Not offered on a regular basis
8860,Biomedical Informatics,"This course introduces advanced topics and applications of biomedical informatics, including health informatics systems, imaging informatics systems, computer-aided diagnosis, computer-aided follow-up, and translational biomedical informatics systems. Advanced applications of state-of-the-art biomedical informatics software systems will be emphasized.",Not offered on a regular basis
8920,Decision Making Under Uncertainty,"Choosing optimally among different lines of actions is a key aspect of autonomy in artificial agents. The process by which an agent arrives at this choice is complex, particularly in environments that are noisy and/or shared with other agents. This course will focus on how to make optimal and approximately optimal decisions in multiagent settings. It will be self-contained, introducing relevant background literature such as aspects of probability and game theories.",Not offered on a regular basis
8940,Computational Intelligence,"Programs that solve complex problems in a particular domain, typically independent of knowledge used to direct the search for an optimal solution. Approaches include simulated annealing, genetic algorithms, neural networks.",Not offered on a regular basis
8945,Advanced Representation Learning,"Advanced representation learning algorithms in machine learning, from the traditional subspace learning models to the recent deep representation learning models. Applications in the fields of computer vision, data mining, and natural language processing will be covered.",Not offered on a regular basis
8950,Machine Learning,An in-depth introduction to machine learning methods and an exploration of research problems in machine learning and its applications which may lead to work on a project or a dissertation.,Not offered on a regular basis
8955,Advanced Data Analytics: Statistical Learning and Optimization,"Advanced topics in data analysis, with an emphasis on statistical learning and related optimization problems. The applications include regression, classification, and other tasks in image analysis. The lectures will be based on books and articles in the field of computer vision and medical image analysis.",Not offered on a regular basis
8960,Privacy-Preserving Data Analysis,"An introduction to the privacy preservation problems, as well as algorithmic and statistical techniques for data privacy, in modern data analysis, such as machine learning and data mining. Approaches include randomized algorithms, synthetic data generation, stability analysis, and so on.",Not offered on a regular basis
8965,Internet of Things Security,"Introduction to security problems associated with the emerging Internet of Things (IoT) technologies, including privacy disclosure and data manipulation. Topics studied include architectural differences leading to such issues, how adversaries launch attacks by either exploiting software vulnerabilities or physically hacking into the hardware, and mitigation techniques, such as trusted booting.",Not offered on a regular basis
8990,Research Seminar,Weekly research seminar. Students must attend and give at least one presentation at the seminar.,Fall/Spring/Summer
9000,Doctoral Research,Research while enrolled for a doctoral degree under the direction of faculty members.,Fall/Spring/Summer
9005,Doctoral Graduate Student Seminar,Advanced supervised experience in an applied setting. This course may not be used to satisfy a student's approved program of study.,Fall/Spring/Summer
9300,Doctoral Dissertation,Dissertation writing under the direction of the major professor.,Fall/Spring/Summer